{
  "path_plan_proposal_id": "f3111111-1111-4111-8111-111111111111",
  "path_step_id": "fe611111-1111-4111-8111-111111111111",
  "profile_snapshot_id": "fc111111-1111-4111-8111-111111111111",
  "retrieval_evidence_ids": [
    "fd111111-1111-4111-8111-111111111111"
  ],
  "target_knowledge_node_ids": [
    "linked_list_pointer"
  ],
  "difficulty_level": 2,
  "resource_type": "mixed"
}
